{
  "schemaVersion": "course1-learning-claim-evidence-matrix-v1",
  "courseId": "course-1-controlled-ai-workflow-foundations",
  "contractPath": "COURSE_1_LEARNING_VALIDATION_CONTRACT.md",
  "evidenceRecordSchemaPath": "audit_control/course1/learning_evidence_record.schema.json",
  "evidenceRecordTemplatePath": "release_evidence/templates/COURSE_1_LEARNING_EVIDENCE_RECORD.template.json",
  "releaseEvidenceRoot": "release_evidence/course1_learning_validation",
  "requirements": [
    {
      "requirementId": "C1-LV-001",
      "owner": "Course maintainer",
      "observableCapability": "Every Course 1 teaching, preparation, validation, and readiness claim is bounded by an observable capability, evidence class, assessment method, pass condition, limitation, and later boundary.",
      "claim": "The Course 1 promise and release language do not exceed the evidence that is actually recorded.",
      "evidenceClasses": [
        "INDEPENDENT_ARTIFACT_ASSESSMENT"
      ],
      "assessmentMethods": [
        {
          "methodId": "C1-LVM-001",
          "type": "hybrid",
          "locator": "COURSE_1_REQUIREMENTS_TRACEABILITY.md",
          "selector": "## Learning and evidence map",
          "environment": "maintainer validation followed by independent release review",
          "passCondition": "A signed candidate-bound review maps every learner-facing and release claim to this closed matrix and finds no overclaim or missing boundary."
        }
      ],
      "limitation": "A complete matrix proves traceability, not that the learner or product passed the underlying methods.",
      "laterBoundary": "Course 2 discovery, client work, production use, and consulting readiness remain separately gated.",
      "currentEvidence": {
        "status": "UNVERIFIED",
        "records": []
      },
      "learningDecision": {
        "status": "NOT YET",
        "reason": "No signed candidate-bound claim review exists."
      }
    },
    {
      "requirementId": "C1-LV-002",
      "owner": "Course validation maintainer",
      "observableCapability": "Automated checks state the exact structural or behavioural property they test and reject positive, negative, missing, malformed, and contradictory cases where applicable.",
      "claim": "Automated validation is reported as artifact or technical evidence and never as proof of comprehension or independent judgment.",
      "evidenceClasses": [
        "AUTOMATED_ARTIFACT"
      ],
      "assessmentMethods": [
        {
          "methodId": "C1-LVM-002",
          "type": "automated",
          "locator": "tools/validate_package.py",
          "selector": "def validate_beginner_practice_contract",
          "environment": "fresh exact package-validation environment",
          "passCondition": "The candidate-bound report names each exact property and its negative controls; missing, malformed, contradictory, unknown, or skipped cases fail closed."
        }
      ],
      "limitation": "Artifact checks cannot prove understanding, usability, oral ability, independent judgment, transfer, or retention.",
      "laterBoundary": "Human learning evidence remains mandatory and non-substitutable.",
      "currentEvidence": {
        "status": "UNVERIFIED",
        "records": []
      },
      "learningDecision": {
        "status": "NOT YET",
        "reason": "No candidate-bound learning artifact report with the required semantic negative evidence exists."
      }
    },
    {
      "requirementId": "C1-LV-003",
      "owner": "Assessment owner",
      "observableCapability": "Learner confidence, difficulty, time, fatigue, confusion, and help are recorded separately from scored competence.",
      "claim": "Course 1 preserves useful self-reflection without allowing it to raise a score or replace independent evidence.",
      "evidenceClasses": [
        "LEARNER_SELF_REFLECTION"
      ],
      "assessmentMethods": [
        {
          "methodId": "C1-LVM-003",
          "type": "manual",
          "locator": "modules/MODULE_09.md",
          "selector": "learner_self_reflection.md",
          "environment": "synthetic learner project",
          "passCondition": "The learner reflection records the required experience fields and remains visibly separate from every assessor score and competence decision."
        }
      ],
      "limitation": "Self-reflection records what the learner reports; it does not prove an action occurred or that competence exists.",
      "laterBoundary": "Independent artifact and oral gates remain required for Course 1 competence.",
      "currentEvidence": {
        "status": "UNVERIFIED",
        "records": []
      },
      "learningDecision": {
        "status": "NOT YET",
        "reason": "No candidate-bound learner reflection record exists."
      }
    },
    {
      "requirementId": "C1-LV-004",
      "owner": "Independent artifact assessment owner",
      "observableCapability": "A calibrated person who did not create or edit the work applies the fixed rubric, cites evidence, declares conflicts and help, and does not repair during scoring.",
      "claim": "A Course 1 artifact competence result is independently evidence-calibrated rather than self-awarded.",
      "evidenceClasses": [
        "INDEPENDENT_ARTIFACT_ASSESSMENT"
      ],
      "assessmentMethods": [
        {
          "methodId": "C1-LVM-004",
          "type": "manual",
          "locator": "ASSESSMENT_AND_RUBRIC.md",
          "selector": "## Assessment roles and separate results",
          "environment": "live independent assessment of one frozen synthetic learner package",
          "passCondition": "Every prerequisite and scored area has an assessor-supported result, evidence path, reason, conflict/help declaration, and no unsupported or disputed pass."
        }
      ],
      "limitation": "Artifact assessment does not prove speech, real-user acceptance, production readiness, or long-term retention.",
      "laterBoundary": "Oral, UAT, retention, and later-course readiness remain separately gated.",
      "currentEvidence": {
        "status": "UNVERIFIED",
        "records": []
      },
      "learningDecision": {
        "status": "NOT YET",
        "reason": "No complete candidate-bound independent artifact assessment exists."
      }
    },
    {
      "requirementId": "C1-LV-005",
      "owner": "Independent oral assessment owner",
      "observableCapability": "The learner answers live, one question at a time, without prepared wording, handles evidence-based follow-ups, and can say I do not know while naming a safe next step.",
      "claim": "Verified oral competence means independently observed explanation in the learner's own words.",
      "evidenceClasses": [
        "INDEPENDENT_ORAL_ASSESSMENT"
      ],
      "assessmentMethods": [
        {
          "methodId": "C1-LVM-005",
          "type": "manual",
          "locator": "ASSESSMENT_AND_RUBRIC.md",
          "selector": "## Oral demonstration questions",
          "environment": "live one-question-at-a-time oral assessment",
          "passCondition": "All required concepts are accurately explained; at least one weak, vague, or unsupported answer receives an evidence follow-up; unsafe overclaims are rejected; unknowns lead to a safe next step."
        }
      ],
      "limitation": "A written answer, self-attestation, recording alone, or model review cannot verify live oral competence.",
      "laterBoundary": "Oral competence does not prove production readiness, customer demand, or real UAT.",
      "currentEvidence": {
        "status": "UNVERIFIED",
        "records": []
      },
      "learningDecision": {
        "status": "NOT YET",
        "reason": "No candidate-bound independently observed oral assessment exists."
      }
    },
    {
      "requirementId": "C1-LV-006",
      "owner": "Curriculum and rehearsal owner",
      "observableCapability": "The learner performs synthetic operator, reviewer, failure, evidence, approval, fallback, defect, and retest tasks while acting in explicitly separated roles.",
      "claim": "Solo operational practice is a role-simulated acceptance rehearsal and always retains EXTERNAL UAT NOT VERIFIED.",
      "evidenceClasses": [
        "ROLE_SIMULATED_ACCEPTANCE_REHEARSAL"
      ],
      "assessmentMethods": [
        {
          "methodId": "C1-LVM-006",
          "type": "manual",
          "locator": "modules/MODULE_09.md",
          "selector": "### Recreation 3B — Perform the six operator tasks",
          "environment": "local synthetic learner project with no external actions",
          "passCondition": "Every predefined role-simulated task records evidence, help, defects, correction, and retest and is never titled or summarised as completed real UAT."
        }
      ],
      "limitation": "The learner acting in another role is not another intended user and cannot verify external acceptance.",
      "laterBoundary": "Another consenting person is required for REAL SYNTHETIC UAT; production acceptance remains out of scope.",
      "currentEvidence": {
        "status": "UNVERIFIED",
        "records": []
      },
      "learningDecision": {
        "status": "NOT YET",
        "reason": "No complete candidate-bound role-simulated rehearsal record exists."
      }
    },
    {
      "requirementId": "C1-LV-007",
      "owner": "Real synthetic UAT owner",
      "observableCapability": "Another consenting intended user performs predefined realistic tasks with synthetic data and without the answer key while the facilitator records observed use and retest.",
      "claim": "REAL SYNTHETIC UAT VERIFIED is used only for valid independent observed task evidence.",
      "evidenceClasses": [
        "REAL_SYNTHETIC_UAT"
      ],
      "assessmentMethods": [
        {
          "methodId": "C1-LVM-007",
          "type": "manual",
          "locator": "templates/uat_script.md",
          "selector": "### Required participant briefing — complete before consent",